instruction,response,category
How do I reset my password?,"To reset your password, please follow these steps: 1) Go to the login page, 2) Click on 'Forgot Password', 3) Enter your email address, 4) Check your email for a reset link, 5) Click the link and create a new password. If you don't receive the email within 5 minutes, please check your spam folder.",Account Management
I want to cancel my subscription,"We're sorry to hear you want to cancel. To cancel your subscription: 1) Log into your account, 2) Go to 'Account Settings', 3) Select 'Subscription', 4) Click 'Cancel Subscription'. Your access will continue until the end of your current billing period. Is there anything we can help with to improve your experience?",Billing
Where is my order? It's been 2 weeks since I placed it.,"I apologize for the delay with your order. Let me look into this for you. Please provide your order number and I'll check the shipping status immediately. Typically, orders ship within 3-5 business days, but delays can occur during peak periods. Once I have your order details, I can provide you with tracking information and estimated delivery date.",Shipping & Delivery
The product I received is damaged. What should I do?,"I'm very sorry to hear your product arrived damaged. We want to make this right for you. Please send us photos of the damage and your order number. We'll arrange either a replacement or full refund, whichever you prefer. We'll also provide a prepaid return label for the damaged item. Your satisfaction is our priority.",Returns & Refunds
How do I change my shipping address?,"To update your shipping address: 1) Log into your account, 2) Navigate to 'Account Settings', 3) Select 'Addresses', 4) Click 'Edit' next to the address you want to change, or 'Add New Address'. If you have an order in progress, please contact us immediately so we can update it before shipping.",Account Management
I was charged twice for my order,"I sincerely apologize for the duplicate charge. This can sometimes happen due to a processing error. Don't worry - I'll investigate this right away. Please provide your order number and the last 4 digits of the card used. We'll initiate a refund for the duplicate charge within 3-5 business days.",Billing
What are your business hours?,"Our customer support team is available Monday through Friday, 9 AM to 6 PM EST. For urgent issues outside these hours, you can email us and we'll respond first thing the next business day. You can also check our FAQ section for immediate answers to common questions.",General Inquiry
The app keeps crashing when I try to login,"I'm sorry you're experiencing issues with the app. Let's troubleshoot this together: 1) First, try clearing the app cache, 2) Ensure you have the latest version installed, 3) Restart your device, 4) Try uninstalling and reinstalling the app. If the issue persists, please let me know your device model and OS version so our technical team can investigate further.",Technical Support
I need an invoice for my purchase,"Certainly! I can help you get your invoice. You can access all your invoices by: 1) Logging into your account, 2) Going to 'Order History', 3) Clicking on the specific order, 4) Selecting 'Download Invoice'. If you need a modified invoice for business purposes, please let me know the required details.",Billing
What is your return policy?,"Our return policy allows returns within 30 days of purchase for most items. Products must be in original condition with tags attached. To initiate a return: 1) Log into your account, 2) Go to 'Order History', 3) Select the order, 4) Click 'Return Items'. We'll provide a prepaid shipping label. Refunds are processed within 5-7 business days after we receive the item.",Returns & Refunds
I forgot my username,"No problem! You can recover your username by: 1) Going to the login page, 2) Clicking 'Forgot Username', 3) Entering the email address associated with your account. We'll send your username to that email. If you don't have access to that email anymore, please contact us with your account verification details.",Account Management
Can I change my order after placing it?,"You can modify your order within 1 hour of placing it, before it enters processing. To make changes: 1) Go to 'Order History', 2) Find your order, 3) Click 'Modify Order'. After this window, please contact us immediately and we'll do our best to accommodate your request if the order hasn't shipped yet.",Shipping & Delivery
How do I apply a promo code?,"To apply a promo code: 1) Add items to your cart, 2) Proceed to checkout, 3) Look for the 'Promo Code' or 'Discount Code' field, 4) Enter your code and click 'Apply'. The discount will be reflected in your total. Note that some codes have exclusions or minimum purchase requirements.",Product Information
Why was my payment declined?,"Payment declines can happen for several reasons: 1) Incorrect card details, 2) Insufficient funds, 3) Card expiration, 4) Bank security blocks. Please verify your card information and try again. If the issue persists, contact your bank to ensure they're not blocking the transaction. You can also try an alternative payment method.",Billing
How long does shipping take?,"Shipping times vary by location: Standard shipping (5-7 business days), Express shipping (2-3 business days), Overnight shipping (next business day). You can select your preferred shipping method at checkout. Note that these are estimates and may vary during peak seasons or due to carrier delays.",Shipping & Delivery
The website is not loading properly,"I apologize for the inconvenience with our website. Please try these steps: 1) Clear your browser cache and cookies, 2) Try a different browser, 3) Disable browser extensions, 4) Check your internet connection. If the issue continues, please let me know your browser type and version so we can investigate. You can also try our mobile app as an alternative.",Technical Support
I received the wrong item in my order,"I'm so sorry for this error. Please don't worry - we'll fix this right away. Could you please send us: 1) Your order number, 2) A photo of the item you received, 3) The correct item you ordered. We'll ship the correct item immediately and arrange a return pickup for the wrong item at no cost to you.",Returns & Refunds
How do I track my order?,"You can track your order by: 1) Logging into your account, 2) Going to 'Order History', 3) Clicking on your order, 4) Selecting 'Track Package'. You can also use the tracking link sent to your email. If you don't see tracking info, your order may still be processing. Tracking updates typically appear within 24-48 hours of shipping.",Shipping & Delivery
Can I get a refund to my original payment method?,"Yes, refunds are processed to your original payment method by default. Credit/debit card refunds typically appear within 5-7 business days. Bank processing times may vary. If you paid with a gift card, the refund will be added back to your gift card balance. Let me know if you need any other assistance with your refund.",Returns & Refunds
How do I update my email address?,"To update your email address: 1) Log into your account, 2) Go to 'Account Settings', 3) Click 'Personal Information', 4) Update your email address, 5) Verify the new email. You'll receive a confirmation link to your new email address. Click it to complete the change. Your old email will remain active until verification is complete.",Account Management
My coupon code isn't working,"I'm sorry your coupon isn't applying. Let's check a few things: 1) Is the code expired? Check the validity dates. 2) Does your order meet the minimum purchase requirement? 3) Are all items in your cart eligible for the discount? Some exclusions may apply. 4) Has the code been used before? Most codes are single-use. If everything looks correct, please share the code and I'll investigate.",Product Information
I need to speak to a supervisor,"I understand you'd like to escalate this matter. I want to ensure your concern is resolved. Please share the details of your issue, and I'll either resolve it myself or connect you with a supervisor right away. Our goal is to address your concerns as quickly and effectively as possible.",General Inquiry
How do I create an account?,"Creating an account is easy! 1) Click 'Sign Up' on our homepage, 2) Enter your email address, 3) Create a strong password, 4) Fill in your name and contact details, 5) Accept our terms and conditions, 6) Click 'Create Account'. You'll receive a verification email - click the link to activate your account.",Account Management
What payment methods do you accept?,"We accept various payment methods for your convenience: Credit cards (Visa, MasterCard, American Express, Discover), Debit cards, PayPal, Apple Pay, Google Pay, and Gift Cards. All transactions are secured with industry-standard encryption. You can save your preferred payment method in your account for faster checkout.",Billing
My item is out of stock. When will it be available?,"I apologize that the item is currently out of stock. You can: 1) Click 'Notify Me' on the product page to receive an email when it's back, 2) Check our 'Coming Soon' section for expected restock dates, 3) Browse similar products that are available. Typically, popular items are restocked within 2-4 weeks.",Product Information
How do I leave a product review?,"We'd love to hear your feedback! To leave a review: 1) Go to the product page, 2) Scroll to 'Customer Reviews', 3) Click 'Write a Review', 4) Rate the product (1-5 stars), 5) Write your review, 6) Add photos if you'd like, 7) Submit. Your review helps other customers make informed decisions!",Product Information
Can I pick up my order in store?,"Yes! We offer in-store pickup at select locations. During checkout: 1) Select 'Pick Up In Store', 2) Choose your preferred store location, 3) Complete your order. You'll receive an email when your order is ready (usually within 2 hours). Bring your order confirmation and ID to pick up. Items are held for 7 days.",Shipping & Delivery
My account was hacked. What should I do?,"I'm sorry to hear this - let's secure your account immediately. Please: 1) Reset your password right away, 2) Enable two-factor authentication, 3) Review your recent orders for any unauthorized purchases, 4) Check your saved payment methods. We'll also flag your account for additional security monitoring. Report any fraudulent charges so we can investigate.",Technical Support
What is the warranty on this product?,"Our products typically come with a 1-year manufacturer's warranty covering defects in materials and workmanship. Some products have extended warranty options available at checkout. For warranty claims: 1) Check your order for warranty coverage, 2) Contact us with your issue description, 3) We'll provide repair or replacement instructions.",Product Information
How do I unsubscribe from marketing emails?,"You can manage your email preferences by: 1) Clicking 'Unsubscribe' at the bottom of any marketing email, or 2) Logging into your account, going to 'Communication Preferences', and adjusting your settings. Note that you'll still receive important transactional emails about your orders. Changes take effect within 24-48 hours.",Account Management
How do I enable two-factor authentication?,"To enable two-factor authentication (2FA): 1) Go to Account Settings, 2) Select 'Security', 3) Click 'Enable Two-Factor Authentication', 4) Choose your preferred method (SMS or authenticator app), 5) Follow the verification steps. 2FA adds an extra layer of security to protect your account.",Account Management
I can't log into my account,"I'm sorry you're having trouble logging in. Let's resolve this: 1) Make sure Caps Lock is off, 2) Try resetting your password using 'Forgot Password', 3) Clear your browser cache and cookies, 4) Try a different browser or device, 5) Check if your account email is correct. If none of these work, contact us and we'll verify your account manually.",Account Management
My subscription renews but I didn't authorize it,"I understand your concern about the subscription renewal. Our subscriptions auto-renew by default to ensure uninterrupted service. You should have received a renewal reminder email 7 days prior. To avoid future auto-renewals, go to Account Settings > Subscription > Turn off Auto-Renewal. For a refund of this charge, please contact us within 3 days of renewal.",Billing
How do I upgrade my subscription plan?,"To upgrade your subscription: 1) Log into your account, 2) Go to 'Account Settings', 3) Select 'Subscription', 4) Click 'Upgrade Plan', 5) Choose your new plan, 6) Confirm payment. The upgrade takes effect immediately and you'll be charged the prorated difference for the remaining billing period.",Billing
I have a billing discrepancy on my statement,"I'm sorry to hear about the billing discrepancy. Please provide: 1) The charge amount and date, 2) Your order number (if applicable), 3) Last 4 digits of the card charged. I'll investigate immediately and ensure any incorrect charges are refunded within 3-5 business days.",Billing
Can I get a price match if the item is now cheaper?,"Yes, we offer price matching within 14 days of your purchase if the price drops on our website. To request a price match: 1) Contact us with your order number, 2) Provide the current lower price, 3) We'll issue a store credit or refund for the difference. Note: We match prices only from our own store, not competitors.",Billing
My package was marked delivered but I didn't receive it,"I'm sorry to hear your package wasn't received despite being marked delivered. Please: 1) Check with neighbors or building reception, 2) Look for any delivery notes left at your door, 3) Wait 24 hours as GPS tracking can sometimes update prematurely. If still not found, contact us with your order number and we'll file a claim with the carrier and arrange a replacement.",Shipping & Delivery
How do I change my delivery date?,"To change your delivery date: 1) Log into your account, 2) Go to 'Order History', 3) Select your order, 4) Click 'Reschedule Delivery'. Note that delivery date changes are only available for express/scheduled deliveries and must be made at least 2 hours before the current delivery window. Standard orders cannot be rescheduled once shipped.",Shipping & Delivery
Can I ship to multiple addresses in one order?,"Currently, each order can only be shipped to one address. However, you can place separate orders for different shipping addresses. If you're ordering gifts for multiple recipients, consider placing individual orders. We're working on adding multi-address shipping to make this easier for our customers.",Shipping & Delivery
My tracking number isn't working,"Tracking numbers typically become active 24-48 hours after your order ships. If your tracking number still isn't working after 48 hours: 1) Double-check you're entering it on the correct carrier's website (check your shipping confirmation email), 2) Ensure there are no extra spaces. If the issue persists, contact us with your order number and we'll look into this with the carrier.",Shipping & Delivery
How do I return a gift?,"You can return a gift without the original purchaser knowing. To start a gift return: 1) Go to our Returns portal, 2) Enter your order number (from the packing slip) or the email used for the order, 3) Select 'Return a Gift', 4) Choose your refund preference (store credit is issued to you, not the gift giver). The original purchaser won't be notified.",Returns & Refunds
What items cannot be returned?,"Some items are non-returnable for hygiene and safety reasons: Underwear and swimwear (unless defective), Personalized/custom items, Digital downloads, Gift cards, Items marked as 'Final Sale'. Perishable goods and hazardous materials are also excluded. If you received a defective non-returnable item, please contact us - we'll make an exception.",Returns & Refunds
How long does it take to process my refund?,"Once we receive your returned item, refunds are processed within 3-5 business days. After processing: Credit/debit cards take an additional 3-5 business days to appear on your statement, PayPal refunds appear within 24 hours, Store credit is applied immediately. You'll receive an email confirmation when your refund is processed.",Returns & Refunds
Can I exchange an item instead of returning it?,"Yes! We offer direct exchanges for different sizes or colors of the same item. To request an exchange: 1) Start a return request as normal, 2) Select 'Exchange' instead of 'Refund', 3) Choose the new size/color you'd like. If the exchanged item has a different price, we'll charge or refund the difference. Exchanges ship within 2-3 business days of receiving your return.",Returns & Refunds
The product doesn't match the description on the website,"I sincerely apologize that the product doesn't match the website description. This is unacceptable and we want to make it right. Please send us photos of the product you received along with your order number. We'll arrange an immediate return at no cost and provide either a full refund or replacement. We'll also review the product listing to correct any inaccuracies.",Returns & Refunds
How do I compare products?,"To compare products on our website: 1) Browse to the products you're interested in, 2) Click the 'Add to Compare' checkbox on each product (up to 4 items), 3) Click 'Compare' at the bottom of the page. You'll see a side-by-side comparison of features, specifications, pricing, and customer ratings to help you make an informed decision.",Product Information
Do you offer bulk/wholesale pricing?,"Yes, we offer competitive wholesale pricing for orders of 10+ units. To inquire about bulk pricing: 1) Contact our wholesale team at wholesale@company.com, 2) Provide the product(s) and quantities needed, 3) We'll send you a custom quote within 2 business days. Wholesale orders typically qualify for 15-30% discounts depending on volume.",Product Information
How do I find the right size?,"We have a detailed size guide to help you find the perfect fit: 1) Click 'Size Guide' on the product page, 2) Take your measurements as instructed, 3) Match your measurements to our size chart. We recommend sizing up if you're between sizes. If you're still unsure, our customer service team is happy to help with specific product recommendations.",Product Information
Is this product compatible with my device?,"Great question! To verify product compatibility: 1) Check the 'Compatibility' section on the product page, 2) Use our compatibility checker tool by entering your device model, 3) Read customer reviews filtering by your device type. If you still have doubts, share your device model with us and we'll confirm compatibility before you purchase.",Product Information
How do I check product availability at my local store?,"To check local store availability: 1) Go to the product page, 2) Click 'Check Store Availability', 3) Enter your zip code or city, 4) You'll see which nearby stores have the item in stock. You can also filter by distance. Store inventory updates hourly, so availability is generally accurate. Call the store directly to confirm for time-sensitive purchases.",Product Information
Can I place an order by phone?,"Yes, our phone ordering service is available Monday to Friday, 9 AM - 6 PM EST at our customer service number. Our agents can help you browse products, check availability, place orders, and process payments securely over the phone. Please have your payment information ready. A confirmation email will be sent once your order is placed.",General Inquiry
Do you have a loyalty/rewards program?,"Yes! Our rewards program gives you points for every purchase. Here's how it works: Earn 1 point per $1 spent, 500 points = $5 reward, Bonus points on birthdays and special events, Exclusive member discounts and early access to sales. To join: 1) Log into your account, 2) Go to 'Rewards', 3) Click 'Enroll Now'. It's free to join!",General Inquiry
How do I find my order confirmation number?,"Your order confirmation number can be found in: 1) The confirmation email sent to your registered email address (check spam if not found), 2) Your account under 'Order History', 3) Any shipping notification emails. If you checked out as a guest, search your email for messages from us around the purchase date. Contact us if you still can't locate it.",General Inquiry
Can I use multiple discount codes on one order?,"Currently, only one discount code can be applied per order. If you have multiple codes, we recommend using the one with the highest value. However, discount codes can sometimes be combined with automatic promotions (like free shipping thresholds). If you're unsure which code offers the best savings, our customer service team can help you compare.",General Inquiry
What is your privacy policy regarding my personal data?,"We take your privacy seriously. Key points of our privacy policy: We only collect data necessary for order processing and account management. We never sell your personal data to third parties. You can request a copy or deletion of your data at any time via Account Settings > Privacy. We use industry-standard encryption for all data storage and transmission. Full policy available at our website.",General Inquiry
The app is running very slowly on my phone,"I'm sorry the app is running slowly. Here are some steps to improve performance: 1) Close background apps to free up memory, 2) Ensure you're on a stable Wi-Fi or 4G connection, 3) Clear the app cache (Settings > Apps > Our App > Clear Cache), 4) Update to the latest app version, 5) Restart your phone. If slowness continues, please share your phone model and OS version so we can investigate further.",Technical Support
I'm getting an error message when trying to checkout,"I'm sorry you're encountering a checkout error. Please try these steps: 1) Refresh the page and try again, 2) Clear your browser cache and cookies, 3) Try a different payment method, 4) Disable browser extensions that might block scripts, 5) Try a different browser or device. Please share the exact error message you're seeing and I'll escalate to our technical team if needed.",Technical Support
My two-factor authentication code isn't working,"I'm sorry you're having trouble with your 2FA code. Let's troubleshoot: 1) Ensure your device clock is synced correctly (TOTP codes are time-sensitive), 2) Use the most recent code generated, 3) If using SMS, check if you have signal, 4) Try requesting a new code. If you're locked out, use your backup codes. If you don't have backup codes, contact us to verify your identity and restore access.",Technical Support
How do I connect my account to a third-party app?,"To connect a third-party app to your account: 1) Go to Account Settings, 2) Select 'Integrations' or 'Connected Apps', 3) Browse available integrations and select the app, 4) Click 'Connect' and follow the authorization prompts. You can review and revoke app permissions at any time from the same section. If your desired app isn't listed, contact us to request an integration.",Technical Support
The product images are not loading on the website,"If product images aren't loading, please try: 1) Hard refresh the page (Ctrl+Shift+R or Cmd+Shift+R), 2) Clear browser cache, 3) Check your internet connection speed, 4) Disable any ad blockers that might block image CDN domains, 5) Try a different browser. If images still don't load, it may be a temporary server issue - please try again in 30 minutes and contact us if the problem continues.",Technical Support
I accidentally deleted my account. Can I recover it?,"I'm sorry to hear that. Account deletions can sometimes be recovered within 30 days if requested promptly. Please contact us immediately with: 1) The email address associated with the deleted account, 2) Your full name, 3) A recent order number to verify ownership. Our team will attempt to restore your account and all associated data. After 30 days, restoration may not be possible.",Account Management
How do I transfer my account to a new email address?,"To transfer your account to a new email: 1) Log into your current account, 2) Go to Account Settings > Personal Information, 3) Update your email address, 4) You'll receive a verification link at the new email - click it to confirm the transfer. All your order history, saved items, and preferences will move to the new email automatically.",Account Management
Can I have multiple accounts under the same email?,"Each email address can only be associated with one account. If you need separate accounts (e.g., personal and business), you'll need to use different email addresses for each. If you've accidentally created duplicate accounts, contact us and we can help merge them, transferring your order history and preferences to your preferred account.",Account Management
How do I add a family member to my account?,"You can add family members to your account under our Family Sharing feature: 1) Go to Account Settings, 2) Select 'Family & Sharing', 3) Click 'Add Family Member', 4) Enter their email address, 5) They'll receive an invitation to join. Family members can access shared benefits like subscriptions and loyalty points, but each member has their own login credentials.",Account Management
I received a suspicious email claiming to be from you,"Thank you for bringing this to our attention - this sounds like a phishing attempt. We will NEVER ask for your password, full credit card numbers, or SSN via email. Please: 1) Do NOT click any links in the suspicious email, 2) Do NOT provide any personal information, 3) Forward the email to security@company.com, 4) Delete the email. Check that any real emails from us come from @company.com domain only.",Technical Support
