instruction,response,category
How do I report a bug or technical issue?,"Thank you for helping us improve! To report a bug: 1) Go to our Help Center and click 'Report a Bug', 2) Describe what you were doing when the issue occurred, 3) Include screenshots if possible, 4) Mention your device, browser/app version, and operating system. Our technical team reviews all bug reports and you'll receive an update when the issue is resolved.",Technical Support
My order shows 'On Hold'. What does that mean?,"An order status of 'On Hold' typically means there's a temporary issue we need to resolve before your order can proceed. Common reasons include: Payment verification pending, Address confirmation needed, Item availability change. Please check your email for a message from us explaining the specific reason and any action required from you. If you haven't received an email, contact us with your order number.",Shipping & Delivery
Can I upgrade my shipping after placing an order?,"Shipping upgrades are possible if your order hasn't entered the shipping process yet. Please contact us immediately with your order number and the desired shipping upgrade. We'll check if it's still possible to make the change. Note that you'll be charged the difference between shipping costs. Once a label has been generated, shipping upgrades are no longer possible.",Shipping & Delivery
Do you ship internationally?,"Yes, we ship to over 50 countries worldwide! International shipping rates and delivery times vary by destination: Economy International (10-15 business days), Standard International (7-10 business days), Express International (3-5 business days). Please note that international orders may be subject to customs duties and taxes, which are the customer's responsibility. Check our shipping page for your specific country.",Shipping & Delivery
My delivery was attempted but I wasn't home,"If a delivery attempt was made when you weren't home, the carrier typically leaves a delivery notice. You can: 1) Reschedule delivery online using the tracking number, 2) Pick up from the carrier's local facility (usually held for 5-7 days), 3) Authorize delivery without signature for future attempts. The delivery notice or your tracking information will include the carrier's contact details and options.",Shipping & Delivery
How do I cancel my order?,"To cancel your order: 1) Go to 'Order History' in your account, 2) Find your order, 3) Click 'Cancel Order'. Orders can only be cancelled within 1 hour of placement before they enter processing. If the cancellation window has passed, you can refuse delivery or return the item once received. Refunds for cancelled orders are processed within 3-5 business days.",Shipping & Delivery
Is it safe to save my credit card on your website?,"Absolutely. We use industry-leading security measures to protect your payment information: 1) We are PCI DSS Level 1 compliant, 2) Card numbers are tokenized - we never store actual card numbers, 3) All transactions use TLS 1.3 encryption, 4) We use 3D Secure authentication for added protection. You can manage saved payment methods in Account Settings > Payment Methods at any time.",Billing
How do I get a VAT/GST invoice?,"To receive a VAT/GST invoice: 1) Log into your account, 2) Go to 'Order History', 3) Select the relevant order, 4) Click 'Download Tax Invoice'. If you need a B2B invoice with your company's GST/VAT number: go to Account Settings > Business Details, add your company information, then all future invoices will include it. Contact us if you need to update a past invoice.",Billing
My refund amount seems incorrect,"I apologize for the confusion about your refund amount. Common reasons for partial refunds include: Return shipping costs deducted (for non-defective items), Restocking fees for certain items, Promotional discounts that were order-specific. Please share your order number and the refund confirmation email. I'll review the refund calculation and ensure it's corrected if there's an error.",Returns & Refunds
Can I return a digital product?,"Digital products and downloads are generally non-refundable once accessed, as they cannot be 'returned'. However, if you haven't accessed the digital content yet, or if the product is defective/not as described, please contact us within 7 days of purchase. We review these on a case-by-case basis. If the product didn't work or wasn't as described, we'll work to make it right.",Returns & Refunds
How do I check the status of my return?,"To check your return status: 1) Log into your account, 2) Go to 'Order History', 3) Select the relevant order, 4) Click 'View Return Status'. You'll see the current stage of your return (Return Received, Being Processed, Refund Issued). You'll also receive email updates at each stage. If you sent the return more than 7 business days ago and haven't seen an update, contact us with your return tracking number.",Returns & Refunds
The item I want to return is out of its original packaging. Can I still return it?,"We understand that packaging gets opened! You can still return most items without original packaging within our 30-day return window, as long as the item itself is in original condition - unused, undamaged, and complete with all accessories. However, items that require original packaging for safety or hygiene reasons may need it for returns. Please contact us and we'll confirm based on your specific product.",Returns & Refunds
How do I request a price adjustment for a sale?,"We offer price adjustments within 14 days of your purchase if the same item goes on sale at our store. To request a price adjustment: 1) Contact us with your order number, 2) Reference the current sale price and the dates of the sale. We'll issue the difference as a store credit or refund to your original payment method. Note: This applies only to sales on our own website, not competitor pricing.",Billing
Why am I being charged sales tax?,"Sales tax is charged based on the laws of your shipping destination. We're required by law to collect sales tax in states/regions where we have nexus (a tax presence). The tax amount is calculated at checkout based on: Your shipping address, The type of product purchased, and Applicable tax rates. Tax-exempt customers can submit their exemption certificate to our billing team to have tax removed from future orders.",Billing
My gift card balance isn't showing correctly,"I'm sorry your gift card balance appears incorrect. Let's investigate: 1) Log into your account, 2) Go to 'Gift Cards' to see your current balance, 3) Check your recent transaction history to see how the balance was used. If the balance still seems wrong, please share the gift card number (last 4 digits for security) and I'll look into any discrepancies and restore the correct balance.",Billing
How do I get a replacement for a defective product?,"I'm sorry your product is defective! To get a replacement: 1) Contact us within 30 days of purchase (or within warranty period for manufacturing defects), 2) Describe the defect and send photos if possible, 3) Include your order number. We'll arrange a free replacement and provide a prepaid return label for the defective item. Replacements typically ship within 2-3 business days of us receiving your return.",Returns & Refunds
Do you offer gift wrapping?,"Yes, we offer gift wrapping services! To add gift wrapping to your order: 1) Add items to your cart, 2) Proceed to checkout, 3) Select 'Gift Options' before completing payment, 4) Choose your wrapping style, 5) Add a personalized message (up to 150 characters). Gift wrapping costs $4.99 per item. The recipient's packing slip will not include prices.",General Inquiry
Can I send a product directly to someone as a gift?,"Absolutely! To send a gift directly: 1) Add items to your cart, 2) At checkout, enter the recipient's address as the shipping address, 3) Select 'This is a gift' option, 4) Add a gift message if desired. The package will be shipped without a price tag, and the receipt will be sent to your email, not included in the package.",General Inquiry
How do I check if my email address is already registered?,"To check if your email is registered: 1) Go to the login page, 2) Enter your email in the login field, 3) Click 'Continue'. If the email is registered, you'll be prompted for your password. If not, you'll be directed to create a new account. You can also try the 'Forgot Password' option to see if a reset email is sent to that address.",Account Management
I'm having trouble with the search function on your website,"I'm sorry the search isn't working well for you. Try these tips: 1) Use more specific keywords, 2) Try alternate spellings or product names, 3) Use category filters to narrow results, 4) Check for typos in your search terms. If search results seem completely broken, try clearing your browser cache or using a different browser. Please describe what you searched for and I can help you find the product directly.",Technical Support
The checkout page is freezing,"I apologize for the checkout freeze. This is often a browser issue. Please try: 1) Clear all browser cookies and cache, 2) Try incognito/private browsing mode, 3) Disable browser extensions, 4) Use a different browser (Chrome, Firefox, Safari), 5) Ensure JavaScript is enabled. If the issue persists, try our mobile app. Please contact us with the exact point where the page freezes and your browser info.",Technical Support
I cannot add items to my cart,"If you're having trouble adding items to your cart, try these solutions: 1) Refresh the product page, 2) Check if the item requires a size/color selection you haven't made, 3) Clear browser cookies and cache, 4) Try a different browser, 5) Check if you're logged in, 6) Disable ad blockers. If a specific item consistently won't add, it may have a stock issue. Contact us with the item name and I'll check its availability.",Technical Support
My password reset email isn't arriving,"If you haven't received a password reset email: 1) Check your spam/junk folder, 2) Wait 10 minutes - emails can be delayed, 3) Ensure you're checking the correct email inbox (the one registered to your account), 4) Try adding our domain to your safe senders list. If still not received after 30 minutes, contact us. We can manually verify your identity and help reset your password through an alternative method.",Account Management
How do I delete my account?,"To delete your account: 1) Log in and go to Account Settings, 2) Scroll to 'Account Management', 3) Click 'Delete Account', 4) Confirm your password and follow the prompts. Please note: Account deletion is permanent and all your order history, saved items, and rewards points will be lost. Any pending orders or active subscriptions must be resolved before deletion. Consider downloading your data before deleting.",Account Management
How do I view my order history?,"To view your complete order history: 1) Log into your account, 2) Click on 'My Account' or your profile icon, 3) Select 'Order History'. You'll see all past orders with dates, items purchased, order status, and amounts. You can click on any order for detailed information including tracking, invoice, and return options. Orders placed as a guest won't appear here.",Shipping & Delivery
Can I reorder a previous purchase?,"Yes! Reordering is quick and easy: 1) Go to 'Order History' in your account, 2) Find the order you want to repeat, 3) Click 'Reorder', 4) Review the items in your cart (check availability and current pricing), 5) Proceed to checkout. Note that prices and availability may have changed since your original order. You'll get the current price at checkout.",General Inquiry
How do I know if a sale or promotion is legitimate?,"All our sales and promotions are listed on our official website and sent from our verified email domains (@company.com). Warning signs of fake promotions: Emails from unofficial domains, Requests for your password, Too-good-to-be-true discounts. To verify a promotion: Check our website directly, don't click links in suspicious emails. Contact us if you're unsure about a specific offer.",General Inquiry
What is your customer satisfaction guarantee?,"We stand behind every product we sell. Our satisfaction guarantee means: 30-day hassle-free returns for any reason, Full refund or replacement for defective items within warranty period, Price match guarantee within 14 days of purchase. If you're not completely satisfied, contact us and we'll make it right. Our goal is to ensure every customer has an excellent experience.",General Inquiry
How do I use your website's accessibility features?,"Our website includes accessibility features: Screen reader compatibility, Keyboard navigation support, High contrast mode (in display settings), Text size adjustment, Alt text for all images. To enable accessibility mode: Go to website footer > Accessibility Settings. If you need additional assistance, our support team can process orders by phone. We're committed to making our platform accessible to all users.",General Inquiry
My order total looks wrong at checkout,"If your order total seems incorrect at checkout, check: 1) All promotional codes have been applied correctly, 2) The correct quantities are in your cart, 3) Shipping costs - try entering your address if not done yet, 4) Applicable taxes based on your location. If prices don't match what's shown on the product pages, please screenshot the discrepancy and contact us immediately. Pricing errors on our end are always honoured.",Billing
I want to change the quantity of an item in my order,"You can modify item quantities within 1 hour of placing your order. Go to Order History, select your order, and click 'Modify'. After this window, the order is locked for processing. If you need more of the same item, simply place a new order. To reduce quantities after the modification window, you may need to return the unwanted items after delivery.",Shipping & Delivery
Is there a student discount available?,"Yes! We offer a 15% student discount through our student verification program. To access the discount: 1) Go to our Student Discount page, 2) Verify your student status through our partner SheerID, 3) Once verified, your discount will be automatically applied at checkout. Verification requires a valid .edu email or student ID. The discount is valid for as long as you maintain your student status.",General Inquiry
How do I know when a sold-out item will be restocked?,"To get notified when a sold-out item is restocked: 1) Go to the product page, 2) Click 'Notify Me When Available', 3) Enter your email address if prompted, 4) Click 'Set Alert'. You'll receive an email notification as soon as the item is back in stock. Typically, popular items are restocked within 2-4 weeks, but we can't always guarantee restock timelines for all items.",Product Information
Can I get a sample before purchasing?,"We offer samples for select product categories: Cosmetics and beauty products (sample kits available), Paint and flooring (physical samples shipped free), Some food and beverage items. To request a sample: 1) Look for the 'Request Sample' button on eligible product pages, 2) Or contact our team mentioning which product you'd like to sample. Sampling availability varies by product and region.",Product Information
How do I report a counterfeit product?,"If you suspect you've received a counterfeit product, we take this very seriously. Please: 1) Do not use the product, 2) Contact us immediately with your order number and photos of the product, 3) Note any differences from the authentic product (packaging, labels, quality). We'll investigate with our supplier chain, replace your order immediately, and report to the brand manufacturer. Thank you for helping us maintain quality.",Returns & Refunds
What happens to my data if I delete my account?,"When you delete your account: Active order data is retained for legal compliance for up to 7 years, Personal data not linked to transactions is deleted within 30 days, Marketing preferences are removed immediately, Loyalty points and rewards are permanently forfeited, Saved payment methods are deleted immediately. You can request a full data export before deletion. Our full data retention policy is available in our Privacy Policy.",Account Management
I received a package that wasn't addressed to me,"If you received a package not addressed to you: 1) Do not open it, 2) Mark it 'Return to Sender', 3) Give it back to your mail carrier or drop at a post office. If it was opened before you realized, contact us and we'll help coordinate with the carrier to retrieve it. Please don't feel obligated to deliver it yourself - that's the postal service's responsibility.",Shipping & Delivery
How do I apply for a business account?,"To apply for a business account with special pricing and features: 1) Go to our Business section on the website, 2) Click 'Apply for Business Account', 3) Fill in your company details (name, tax ID, contact info), 4) Submit for review. Business accounts are typically approved within 2-3 business days. Benefits include volume discounts, net payment terms, dedicated account manager, and consolidated invoicing.",General Inquiry
My subscription paused but I'm still being charged,"I apologize for this billing error. This should not happen when a subscription is paused. Please provide: 1) Your account email, 2) The date(s) of the incorrect charges, 3) Confirmation of when you paused (screenshot if available). I'll investigate immediately, ensure all incorrect charges are refunded, and fix the subscription pause so it works correctly going forward. You'll hear back within 24 hours.",Billing
How do I add a note or special instructions to my order?,"To add special instructions to your order: 1) Add items to your cart, 2) At checkout, look for 'Order Notes' or 'Special Instructions' field, 3) Type your instructions (gift messages, delivery preferences, allergies for food items, etc.), 4) Complete checkout as normal. Please note that while we'll do our best to accommodate special requests, not all instructions can be guaranteed depending on the item type.",Shipping & Delivery
The app is showing incorrect prices compared to the website,"Thank you for flagging this! Price discrepancies between app and website shouldn't happen. The most likely cause is the app displaying cached prices. To fix: 1) Force-close the app and reopen it, 2) Log out and log back in, 3) Clear app cache. If prices still differ, always trust the price shown at the final checkout screen - that's the actual price you'll be charged. Please send us a screenshot of both prices for our tech team to investigate.",Technical Support
How do I contact you via live chat?,"Our live chat is available through multiple channels: Website: Click the chat bubble icon in the bottom right corner of any page, Mobile App: Go to 'Help' > 'Chat with Us'. Live chat hours are Monday-Friday 9 AM - 8 PM and Saturday 10 AM - 6 PM EST. Outside these hours, you can leave a message and we'll respond via email. Average response time during peak hours is under 3 minutes.",General Inquiry
I want to provide feedback about a customer service interaction,"Thank you for taking the time to provide feedback! Your input helps us improve. You can share feedback through: 1) The satisfaction survey sent after your interaction, 2) Our website's 'Feedback' section under Help, 3) Directly by emailing feedback@company.com. Please include the date of interaction and the agent's name if known. We review all feedback and use it for agent training and service improvement.",General Inquiry
